{
  "schema_version": "candidate-catalog.v1",
  "catalog_id": "candidate-catalog-2026-r1",
  "pass_registry_sha256": "09dddb4c93e7709810c1583b9c73340abfa8369e814b8d075c759f3d782f5db1",
  "candidates": [
    {
      "candidate_id": "candidate.extended-affine-summarization",
      "display_name": "Extended affine recurrence summarization",
      "description": "Summarizes canonical i32 additive recurrences, including degree-two iteration polynomials, with exact modulo-2^32 arithmetic.",
      "stage": "ir_function",
      "remark_pass_id": "candidate.extended-affine-summarization",
      "required_analyses": [
        "loop",
        "scalar-evolution"
      ],
      "legality_obligations": [
        {"obligation_id": "candidate.extended-affine-summarization.canonical-loop", "description": "Require the supported canonical loop and induction shape."},
        {"obligation_id": "candidate.extended-affine-summarization.scev-affine-state", "description": "Prove the state update through the shared SCEV affine recurrence model."},
        {"obligation_id": "candidate.extended-affine-summarization.exact-trip-count", "description": "Derive an exact iteration count before replacing the loop."},
        {"obligation_id": "candidate.extended-affine-summarization.zero-negative-iterations", "description": "Preserve zero and negative-iteration behavior."},
        {"obligation_id": "candidate.extended-affine-summarization.modulo-i32-equivalence", "description": "Preserve i32 modulo-2^32 arithmetic, including polynomial division ordering."},
        {"obligation_id": "candidate.extended-affine-summarization.side-effect-free-body", "description": "Reject loop bodies with unsupported side effects."},
        {"obligation_id": "candidate.extended-affine-summarization.live-outs", "description": "Prove every observable loop live-out is reconstructed exactly."},
        {"obligation_id": "candidate.extended-affine-summarization.profitability", "description": "Apply only when the closed form is expected to reduce work."}
      ],
      "oracle_family_ids": ["closed_form"],
      "qualification_status": "qualified",
      "implementation_status": "implemented",
      "default_enabled": false
    },
    {
      "candidate_id": "candidate.finite-state-acceleration",
      "display_name": "Closed finite-state transition acceleration",
      "description": "Replaces proven closed small-domain pure i32 transitions with bounded binary-lifting jump tables.",
      "stage": "ir_function",
      "remark_pass_id": "candidate.finite-state-acceleration",
      "required_analyses": [
        "induction-variable",
        "loop",
        "scalar-evolution"
      ],
      "legality_obligations": [
        {"obligation_id": "candidate.finite-state-acceleration.constant-finite-domain", "description": "Require a small compile-time constant state domain."},
        {"obligation_id": "candidate.finite-state-acceleration.transition-closure", "description": "Exhaustively prove that every domain state transitions within the domain."},
        {"obligation_id": "candidate.finite-state-acceleration.deterministic-pure-transition", "description": "Require a deterministic transition without memory, calls, or floating-point effects."},
        {"obligation_id": "candidate.finite-state-acceleration.iteration-domain", "description": "Prove the signed iteration domain and preserve short or non-positive loops."},
        {"obligation_id": "candidate.finite-state-acceleration.exact-state-encoding", "description": "Use an injective bounded state and jump-table encoding."},
        {"obligation_id": "candidate.finite-state-acceleration.modulo-i32-equivalence", "description": "Interpret every transition with exact i32 arithmetic."},
        {"obligation_id": "candidate.finite-state-acceleration.storage-code-size", "description": "Enforce per-table and whole-pass storage and code-size limits."},
        {"obligation_id": "candidate.finite-state-acceleration.profitability", "description": "Apply only above the frozen trip-count profitability threshold."}
      ],
      "oracle_family_ids": ["finite_state"],
      "qualification_status": "qualified",
      "implementation_status": "implemented",
      "default_enabled": false
    },
    {
      "candidate_id": "candidate.same-domain-loop-fusion",
      "display_name": "Strict same-domain loop fusion and temporary contraction",
      "description": "Fuses adjacent canonical loops with identical domains while preserving dependence order and contracting proven temporary storage.",
      "stage": "ir_function",
      "remark_pass_id": "candidate.same-domain-loop-fusion",
      "required_analyses": [
        "dependence",
        "global-modref",
        "induction-variable",
        "loop",
        "pointer-provenance"
      ],
      "legality_obligations": [
        {"obligation_id": "candidate.same-domain-loop-fusion.adjacent-canonical-loops", "description": "Require adjacent canonical single-latch loops."},
        {"obligation_id": "candidate.same-domain-loop-fusion.identical-iteration-domain", "description": "Prove both loops traverse the same iteration domain."},
        {"obligation_id": "candidate.same-domain-loop-fusion.dependence-order", "description": "Reject cross-iteration flow, anti, or output dependences that fusion would reorder."},
        {"obligation_id": "candidate.same-domain-loop-fusion.alias-modref", "description": "Require proven pointer roots and mod/ref behavior."},
        {"obligation_id": "candidate.same-domain-loop-fusion.side-effect-order", "description": "Preserve the order of all supported observable effects."},
        {"obligation_id": "candidate.same-domain-loop-fusion.temporary-lifetime", "description": "Contract temporary storage only after proving its complete lifetime and non-escape."},
        {"obligation_id": "candidate.same-domain-loop-fusion.exit-live-outs", "description": "Reject first-loop header or body state observed by the second loop or later code."},
        {"obligation_id": "candidate.same-domain-loop-fusion.profitability", "description": "Apply only when fusion or temporary contraction is expected to reduce work."}
      ],
      "oracle_family_ids": [
        "fusion",
        "boom_ilp"
      ],
      "qualification_status": "qualified",
      "implementation_status": "implemented",
      "default_enabled": false
    },
    {
      "candidate_id": "candidate.integer-linear-transition",
      "display_name": "Integer affine state-transition acceleration",
      "description": "Accelerates small-dimensional pure i32 affine state transitions with exact modulo-2^32 binary lifting.",
      "stage": "ir_function",
      "remark_pass_id": "candidate.integer-linear-transition",
      "required_analyses": [
        "induction-variable",
        "loop",
        "scalar-evolution"
      ],
      "legality_obligations": [
        {"obligation_id": "candidate.integer-linear-transition.small-fixed-dimension", "description": "Require a fixed one-to-three-dimensional state vector."},
        {"obligation_id": "candidate.integer-linear-transition.affine-transition", "description": "Prove simultaneous state updates form one affine transition."},
        {"obligation_id": "candidate.integer-linear-transition.exact-trip-count", "description": "Derive the exact signed remaining trip count."},
        {"obligation_id": "candidate.integer-linear-transition.zero-negative-iterations", "description": "Preserve zero and negative-iteration behavior."},
        {"obligation_id": "candidate.integer-linear-transition.modulo-i32-equivalence", "description": "Perform matrix lifting with exact i32 modulo-2^32 arithmetic."},
        {"obligation_id": "candidate.integer-linear-transition.integer-only", "description": "Reject floating-point and unsupported modulo-sensitive operations."},
        {"obligation_id": "candidate.integer-linear-transition.side-effect-free-body", "description": "Reject memory, call, and other unsupported body effects."},
        {"obligation_id": "candidate.integer-linear-transition.live-outs", "description": "Prove every state live-out is reconstructed exactly."},
        {"obligation_id": "candidate.integer-linear-transition.profitability", "description": "Retain the original loop for unprofitable short executions."}
      ],
      "oracle_family_ids": ["linear_transition"],
      "qualification_status": "qualified",
      "implementation_status": "implemented",
      "default_enabled": false
    },
    {
      "candidate_id": "candidate.rrt2-on-demand-memoization",
      "display_name": "RRT2 bounded on-demand memoization",
      "description": "Memoizes reachable states of bounded two-dimensional pure ranked recurrences without dense-domain enumeration.",
      "stage": "ir_module",
      "remark_pass_id": "candidate.rrt2-on-demand-memoization",
      "required_analyses": ["dominator-tree"],
      "legality_obligations": [
        {"obligation_id": "candidate.rrt2-on-demand-memoization.direct-finite-recursion", "description": "Require direct finite recursion with exactly two i32 state parameters."},
        {"obligation_id": "candidate.rrt2-on-demand-memoization.composite-well-founded-rank", "description": "Prove every recursive edge decreases a composite well-founded rank."},
        {"obligation_id": "candidate.rrt2-on-demand-memoization.pure-context", "description": "Reject memory, external calls, floating point, and other impure context."},
        {"obligation_id": "candidate.rrt2-on-demand-memoization.reachable-domain", "description": "Memoize only states reached by the original recursive control flow."},
        {"obligation_id": "candidate.rrt2-on-demand-memoization.memo-key-injective", "description": "Prove the bounded two-dimensional memo key is injective."},
        {"obligation_id": "candidate.rrt2-on-demand-memoization.base-case-order", "description": "Preserve original base-case and recursive evaluation order."},